id,title,languages,technologies,description,details,hostedUrl,repoTitle,repoUrl,commitsApiUrl
1,Portfolio Website,"HTML;CSS;JavaScript","React;Tailwind;Node.js","My personal portfolio site","This project is a React-based portfolio site styled with Tailwind CSS. It showcases my work, skills, and contact info. Features include responsive design, filterable projects, and smooth scrolling navigation.","https://yourportfolio.com","Portfolio GitHub Repo","https://github.com/Micmada/Portfolio-Website","https://api.github.com/repos/Micmada/Portfolio-Website/commits"
2,F1 Strategy Predictor,"Python","XGBoost;Simulation;AI","Predicts F1 race strategies with GPU-accelerated ML and Monte Carlo simulation","This project predicts and compares Formula 1 race strategies using historical data, machine learning, and Monte Carlo simulation. It uses GPU‐accelerated XGBoost and integrates official F1 rules like tyre usage limits and parc fermé constraints.",,"F1 Strategy Predictor Repo","https://github.com/Micmada/F1-Strategy-Predictor","https://api.github.com/repos/Micmada/F1-Strategy-Predictor/commits"
3,Django Markdown Blog,"Python","Django;Markdown","A Django-based blog engine using Markdown files.","This project is a blog engine built with Django where posts and pages are written in Markdown. It supports metadata front matter, simple CMS-like structure, tag support and is easy to deploy and maintain.",,"Django Markdown Blog Repo","https://github.com/Micmada/django_markdown_blog","https://api.github.com/repos/Micmada/django_markdown_blog/commits"
4,React Data Dashboard,"JavaScript;CSS","React;Tailwind;React Grid Layout;Lucide React;React Router","A dynamic, customizable dashboard built with React, React Grid Layout, and Tailwind CSS.","This dashboard allows users to add, remove, and rearrange widgets such as tables and charts. It features drag-and-drop grid layout, dynamic data tables with selectable columns, dropdown menus for column selection, and a responsive design that adapts to all screen sizes.",,"React Data Dashboard","https://github.com/Micmada/react-data-dashboard","https://api.github.com/repos/Micmada/react-data-dashboard/commits"
5,MERN Task Manager,"JavaScript;CSS","React;Node.js;Express;MongoDB;Mongoose;Axios;Tailwind;JWT;Redux","A full-stack task manager application built with the MERN stack.","This application allows users to create, read, update, and delete tasks. It includes features such as task prioritization, due dates, completion status, and user authentication. The frontend is built with React and styled using Tailwind CSS, while the backend is powered by Node.js, Express, and MongoDB.",,"MERN Task Manager","https://github.com/Micmada/mern-task-manager","https://api.github.com/repos/Micmada/mern-task-manager/commits"
6,Go URL Shortener,"Go","Gin;GORM;SQLite;JWT;bcrypt","A simple URL shortener built with Go, Gin, and GORM.","This project allows users to shorten URLs, redirect short URLs to original URLs, and includes user authentication with registration and login features. It utilizes JWT for authentication and bcrypt for password hashing.",,"Go URL Shortener","https://github.com/Micmada/go-url-shortener","https://api.github.com/repos/Micmada/go-url-shortener/commits"
7,URL Shortener,"Python;HTML;CSS;JavaScript","Flask;RESTful API","A simple URL shortener built with Flask and a front-end HTML/CSS/JavaScript.","This project provides a RESTful API that allows users to shorten long URLs and retrieve the original URLs using the shortened version. The back-end is built with Flask, and the front-end is implemented using HTML, CSS, and JavaScript.",,"URL Shortener","https://github.com/Micmada/Url_Shortener","https://api.github.com/repos/Micmada/Url_Shortener/commits"
8,Microblog,"Python;HTML;CSS;JavaScript","Flask;Flask-Login;SQLite","A simple microblogging web application built with Python and Flask.","This application allows users to register, log in, create posts, and interact with other users through upvotes and downvotes. It includes features such as user authentication, post creation with titles and content, sorting posts by recency or votes, and dark mode support.",,"Microblog","https://github.com/Micmada/microblog","https://api.github.com/repos/Micmada/microblog/commits"
9,Twitter ChatGPT Sentiment Analyzer,"Python","Tweepy;TextBlob;Streamlit;JSON","A Python application that scrapes recent tweets about ChatGPT, performs sentiment analysis, and provides an interactive dashboard.","This project uses the Tweepy library to collect tweets mentioning 'ChatGPT', excluding tweets from OpenAI developers. It then analyzes the sentiment of these tweets using TextBlob and displays the results in a Streamlit-based dashboard. Users can filter tweets by sentiment type.",,"Twitter ChatGPT Sentiment Analyzer","https://github.com/Micmada/twitter-data-miner","https://api.github.com/repos/Micmada/twitter-data-miner/commits"